{
  "changeId": "CHG-OUTDOOR-WEB-001",
  "requirementIds": ["FR-WEB-001", "FR-WEB-002", "NFR-WEB-001"],
  "acceptanceIds": ["AC-WEB-001", "AC-WEB-002", "AC-WEB-003"],
  "type": "static",
  "status": "passed",
  "commit": "uncommitted-worktree",
  "environment": "local Windows, Node 22.22.0, PowerShell, CUA in-app browser",
  "startedAt": "2026-09-12T00:55:00Z",
  "finishedAt": "2026-09-11T17:11:03Z",
  "command": "static file checks; node inline-script syntax check; Invoke-WebRequest http://127.0.0.1:4173/; CUA browser AX check; git diff --check",
  "exitCode": 0,
  "summary": "入口存在且无外部 script src；页面展示个人生活感悟记录内容；页脚仅展示一次用户提供的 ICP 备案号鄂ICP备2023015599号-4并链接工信部备案查询系统；已配置官网 canonical 域名；内联脚本语法通过；HTTP 200；浏览器首屏与移动导航可用。DNS/静态托管接入、公安备案平台提交和公安图标代码尚未执行。",
  "runner": "Codex local exec",
  "artifacts": ["website/dist/index.html", "website/README.md"],
  "artifactsSha256": {
    "website/dist/index.html": "B858CE3B0C4374150E93134C56B4AF7C51564C0F74B6194D881AA92D2C343B97"
  }
}
